{"$schema":"https://json-schema.org/draft/2020-12/schema","$id":"https://fs-gg.github.io/schemas/evidence/corpus-inputs/v1","category":"corpus-inputs","type":"object","required":["schema","id","input","sha256"],"properties":{"schema":{"const":"fsgg.coordination.corpus-input/1"},"id":{"type":"string","pattern":"^C-[a-z0-9-]+$"},"input":{"type":"object","required":["schema","ordinal","kind","source","historicalContext","expectedBehavior","ambiguity","currentV1Result","provenance"],"properties":{"schema":{"const":"fsgg.coordination.frozen-corpus-case/1"},"ordinal":{"type":"integer","minimum":1,"maximum":21},"kind":{"type":"string","minLength":1},"source":{"type":"object","required":["repository","commit","path","ref","mediaType","bytes","sha256","gitBlobSha1","payloadPath"],"properties":{"repository":{"const":"FS-GG/.github"},"commit":{"pattern":"^[0-9a-f]{40}$"},"path":{"type":"string","minLength":1},"ref":{"type":"string","pattern":"^git:[0-9a-f]{40}:.+$"},"mediaType":{"type":"string","minLength":1},"bytes":{"type":"integer","minimum":1},"sha256":{"pattern":"^[0-9a-f]{64}$"},"gitBlobSha1":{"pattern":"^[0-9a-f]{40}$"},"payloadPath":{"type":"string","pattern":"^corpus/originals/C-[a-z0-9-]+\\.source$"}},"additionalProperties":false},"historicalContext":{"type":"string","minLength":1},"expectedBehavior":{"type":"object","required":["decisionClass","predicateId","authority","detail"],"properties":{"decisionClass":{"type":"string","minLength":1},"predicateId":{"type":"string","minLength":1},"authority":{"type":"string","minLength":1},"detail":{"type":"string","minLength":1}},"additionalProperties":false},"ambiguity":{"type":"object","required":["state","rationale"],"properties":{"state":{"enum":["none-recorded","explicit-indeterminate"]},"rationale":{"type":"string","minLength":1}},"additionalProperties":false},"currentV1Result":{"type":"object","required":["state","outcome","evidence","headSha","observedAt","detail"],"properties":{"state":{"enum":["observed","not-atomically-observed"]},"outcome":{"type":["string","null"]},"evidence":{"type":"string","minLength":1},"headSha":{"pattern":"^[0-9a-f]{40}$"},"observedAt":{"type":"string","format":"date-time"},"detail":{"type":"string","minLength":1}},"additionalProperties":false},"provenance":{"type":"object","required":["q0Revision","q0ManifestPath","q0ManifestSha256","q0EvidencePath","q0EvidenceSha256","importedByUnit"],"properties":{"q0Revision":{"pattern":"^[0-9a-f]{40}$"},"q0ManifestPath":{"type":"string","minLength":1},"q0ManifestSha256":{"pattern":"^[0-9a-f]{64}$"},"q0EvidencePath":{"type":"string","minLength":1},"q0EvidenceSha256":{"pattern":"^[0-9a-f]{64}$"},"importedByUnit":{"const":"GS2-03.2"}},"additionalProperties":false}},"additionalProperties":false},"sha256":{"type":"string","pattern":"^[0-9a-f]{64}$"}},"additionalProperties":false}
