{"schema":"fsgg.coordination.corpus-input/1","id":"C-partial","input":{"schema":"fsgg.coordination.frozen-corpus-case/1","ordinal":12,"kind":"partialWrite","source":{"repository":"FS-GG/.github","commit":"95de1c77674b9dd8d7a9ce568d1ee175a7797e5e","path":"tests/FS.GG.Coord.GitHub.Tests/GraphQlErrorsFirstTests.fs","ref":"git:95de1c77674b9dd8d7a9ce568d1ee175a7797e5e:tests/FS.GG.Coord.GitHub.Tests/GraphQlErrorsFirstTests.fs","mediaType":"text/x-fsharp","bytes":52357,"sha256":"b3ca58aae6ba14614934515803dcfc550115f063c37afa4165edee9dc7882f7f","gitBlobSha1":"8b2bc5e605a39cc9c7e989fd16de897d755c09a7","payloadPath":"corpus/originals/C-partial.source"},"historicalContext":"Board partial alias and lost-response fixtures","expectedBehavior":{"decisionClass":"Indeterminate","predicateId":"partial-write-reread","authority":"adapter","detail":"partial outcome is distinct and requires authoritative reread"},"ambiguity":{"state":"explicit-indeterminate","rationale":"Q0 deliberately classifies this expected decision as Indeterminate; the import preserves that ambiguity without selecting a fallback outcome."},"currentV1Result":{"state":"not-atomically-observed","outcome":null,"evidence":"git:15aba28c76551d31b00bac9ff990703f9e61f57d:work/2953-gh-modernization-m0-invariants/q0-evidence.json#corpus/C-partial","headSha":"95de1c77674b9dd8d7a9ce568d1ee175a7797e5e","observedAt":"2026-08-25T22:00:00Z","detail":"Q0 froze these multi-case source bytes and their expected behavior but did not bind an atomic runtime result to this individual artifact; no green result is inferred."},"provenance":{"q0Revision":"15aba28c76551d31b00bac9ff990703f9e61f57d","q0ManifestPath":"work/2953-gh-modernization-m0-invariants/q0-corpus-originals.json","q0ManifestSha256":"5c94fa3ee60e02b7fbee80918b45e5e2046a152a2342f6b88044ac169c1dc67b","q0EvidencePath":"work/2953-gh-modernization-m0-invariants/q0-evidence.json","q0EvidenceSha256":"3a0a73d81823c1667f61f9493c1611aa89b85e24d3e1580cd922d309e2f12f87","importedByUnit":"GS2-03.2"}},"sha256":"b3ca58aae6ba14614934515803dcfc550115f063c37afa4165edee9dc7882f7f"}
