{"schema":"fsgg.coordination.corpus-input/1","id":"C-release","input":{"schema":"fsgg.coordination.frozen-corpus-case/1","ordinal":9,"kind":"release","source":{"repository":"FS-GG/.github","commit":"95de1c77674b9dd8d7a9ce568d1ee175a7797e5e","path":"tests/release-saga/run.sh","ref":"git:95de1c77674b9dd8d7a9ce568d1ee175a7797e5e:tests/release-saga/run.sh","mediaType":"text/x-shellscript","bytes":49893,"sha256":"0fc08e208569245c8e90e5d7de9b2d9d2c3e85fa675c2d011b39ad0dc23b8527","gitBlobSha1":"10229b06270b899e2fbea8e2907be6a9eaff07d1","payloadPath":"corpus/originals/C-release.source"},"historicalContext":"dual-feed saga and #2968 evidence","expectedBehavior":{"decisionClass":"Converge","predicateId":"release-one-pack-two-feeds","authority":"release","detail":"partial publication remains recoverable with identical bytes"},"ambiguity":{"state":"none-recorded","rationale":"Q0 records no case-level ambiguity for this artifact; the import preserves that absence without inferring additional certainty."},"currentV1Result":{"state":"not-atomically-observed","outcome":null,"evidence":"git:15aba28c76551d31b00bac9ff990703f9e61f57d:work/2953-gh-modernization-m0-invariants/q0-evidence.json#corpus/C-release","headSha":"95de1c77674b9dd8d7a9ce568d1ee175a7797e5e","observedAt":"2026-08-25T22:00:00Z","detail":"Q0 froze these multi-case source bytes and their expected behavior but did not bind an atomic runtime result to this individual artifact; no green result is inferred."},"provenance":{"q0Revision":"15aba28c76551d31b00bac9ff990703f9e61f57d","q0ManifestPath":"work/2953-gh-modernization-m0-invariants/q0-corpus-originals.json","q0ManifestSha256":"5c94fa3ee60e02b7fbee80918b45e5e2046a152a2342f6b88044ac169c1dc67b","q0EvidencePath":"work/2953-gh-modernization-m0-invariants/q0-evidence.json","q0EvidenceSha256":"3a0a73d81823c1667f61f9493c1611aa89b85e24d3e1580cd922d309e2f12f87","importedByUnit":"GS2-03.2"}},"sha256":"0fc08e208569245c8e90e5d7de9b2d9d2c3e85fa675c2d011b39ad0dc23b8527"}
