{"schema":"fsgg.coordination.corpus-input/1","id":"C-stale","input":{"schema":"fsgg.coordination.frozen-corpus-case/1","ordinal":13,"kind":"staleRead","source":{"repository":"FS-GG/.github","commit":"95de1c77674b9dd8d7a9ce568d1ee175a7797e5e","path":"tests/engine-freshness/run.sh","ref":"git:95de1c77674b9dd8d7a9ce568d1ee175a7797e5e:tests/engine-freshness/run.sh","mediaType":"text/x-shellscript","bytes":21895,"sha256":"77080fb83663eeecae9372fd4af1ac96b00a888d146e3a7ea7b9004b6229fdfb","gitBlobSha1":"b335121ca972b6ee87bd6de11dba7ba373b2cefd","payloadPath":"corpus/originals/C-stale.source"},"historicalContext":"engine/claim/review freshness incidents","expectedBehavior":{"decisionClass":"Refuse","predicateId":"stale-evidence-no-authority","authority":"protocol","detail":"stale engine or head cannot authorize"},"ambiguity":{"state":"none-recorded","rationale":"Q0 records no case-level ambiguity for this artifact; the import preserves that absence without inferring additional certainty."},"currentV1Result":{"state":"observed","outcome":"passed","evidence":"https://github.com/FS-GG/.github/actions/runs/32908004500","headSha":"95de1c77674b9dd8d7a9ce568d1ee175a7797e5e","observedAt":"2026-08-25T22:50:35Z","detail":"The exact-source-head engine-freshness workflow directly executed the frozen stale-read artifact and completed successfully."},"provenance":{"q0Revision":"15aba28c76551d31b00bac9ff990703f9e61f57d","q0ManifestPath":"work/2953-gh-modernization-m0-invariants/q0-corpus-originals.json","q0ManifestSha256":"5c94fa3ee60e02b7fbee80918b45e5e2046a152a2342f6b88044ac169c1dc67b","q0EvidencePath":"work/2953-gh-modernization-m0-invariants/q0-evidence.json","q0EvidenceSha256":"3a0a73d81823c1667f61f9493c1611aa89b85e24d3e1580cd922d309e2f12f87","importedByUnit":"GS2-03.2"}},"sha256":"77080fb83663eeecae9372fd4af1ac96b00a888d146e3a7ea7b9004b6229fdfb"}
